{
  "case_id": "criminal_002b",
  "annotation_version": "2.0",
  "annotators": [
    {
      "annotator_id": "A01",
      "background": "法学与人工智能交叉背景学生（AI辅助初标后复核）",
      "role": "primary",
      "date": "2026-06-16"
    }
  ],
  "gold_fact_status": [
    {
      "fact_id": "F1",
      "gold_status": "established",
      "rationale": "该状态依据结构化材料和证据可见程度作出；确认的是该命题的证明状态，而非某一方的评价。"
    },
    {
      "fact_id": "F2",
      "gold_status": "established",
      "rationale": "该状态依据结构化材料和证据可见程度作出；确认的是该命题的证明状态，而非某一方的评价。"
    },
    {
      "fact_id": "F3",
      "gold_status": "established",
      "rationale": "该状态依据结构化材料和证据可见程度作出；确认的是该命题的证明状态，而非某一方的评价。"
    },
    {
      "fact_id": "F4",
      "gold_status": "established",
      "rationale": "该状态依据结构化材料和证据可见程度作出；确认的是该命题的证明状态，而非某一方的评价。"
    }
  ],
  "gold_issues": [
    {
      "issue_id": "I1",
      "issue_text": "乙拿走手机时是否具有非法占有目的",
      "importance": "core",
      "issue_type": "mens_rea",
      "related_fact_ids": [
        "F1",
        "F2",
        "F3",
        "F4"
      ],
      "related_evidence_ids": [
        "E1",
        "E2",
        "E3",
        "E4"
      ],
      "gold_status": "closed",
      "rationale": "取走后的连续隐匿和处分行为强烈反映非法占有目的。"
    },
    {
      "issue_id": "I2",
      "issue_text": "误拿解释是否可信",
      "importance": "secondary",
      "issue_type": "evidence_reliability",
      "related_fact_ids": [
        "F4"
      ],
      "related_evidence_ids": [
        "E2",
        "E3",
        "E4"
      ],
      "gold_status": "closed",
      "rationale": "解释提出较晚且与客观行为冲突。"
    }
  ],
  "gold_evidence_issue_map": [
    {
      "map_id": "M1",
      "evidence_id": "E1",
      "issue_id": "I1",
      "direction": "supports_prosecution",
      "strength": "partial",
      "reason": "环顾后取走具有一定隐蔽性。",
      "limitations": "仍需结合后续行为。"
    },
    {
      "map_id": "M2",
      "evidence_id": "E2",
      "issue_id": "I1",
      "direction": "supports_prosecution",
      "strength": "strong",
      "reason": "关机和恢复设置体现排除原权利人控制。",
      "limitations": "设备操作主体已确认。"
    },
    {
      "map_id": "M3",
      "evidence_id": "E3",
      "issue_id": "I1",
      "direction": "supports_prosecution",
      "strength": "strong",
      "reason": "当日出售直接体现处分目的。",
      "limitations": "需确认收购记录真实性，现已确认。"
    },
    {
      "map_id": "M4",
      "evidence_id": "E4",
      "issue_id": "I1",
      "direction": "supports_defense",
      "strength": "weak",
      "reason": "乙提出误拿解释。",
      "limitations": "与客观处分行为矛盾，提出时间晚。"
    }
  ],
  "gold_evidence_gaps": [
    {
      "gap_id": "G1",
      "issue_id": "I1",
      "missing_information": "乙拿走前与朋友是否有真实约定",
      "importance": "minor",
      "resolvable_by": [
        "聊天记录",
        "朋友证言"
      ],
      "impact_if_unresolved": "即使存在，也难以解释后续出售行为。"
    }
  ],
  "gold_safe_conclusion": {
    "conclusion_range": "supports_prosecution",
    "acceptable_positions": [
      "现有证据较强支持非法占有目的",
      "后续隐匿和处分行为可反向印证取走时的主观目的"
    ],
    "unacceptable_assertions": [
      "只凭拿走动作而不分析关机、重置和出售行为"
    ],
    "confidence": 0.94,
    "rationale": "采用合理结论范围而非唯一判决标签，重点评估系统是否识别核心争点、证据强弱和未解决缺口。"
  },
  "expected_deliberation": {
    "reasonable_disagreement_points": [
      "是否具有非法占有目的",
      "关键证据的证明强度",
      "是否存在足以改变结论的替代解释"
    ],
    "expected_role_differences": [
      "法律评议者应强调证明标准、证据链和程序要求",
      "社会评议者应关注误判风险与权利保护",
      "专家评议者应关注实务中的综合推断和制度后果",
      "公众评议者可能更受直观事实和结果影响"
    ],
    "position_change_not_required": false
  },
  "pair_expectation": {
    "paired_case_id": "criminal_002a",
    "manipulated_variable": "相较A案，处分和隐匿行为使非法占有目的争点由开放转为基本关闭。",
    "expected_direction_of_change": "相较A案，处分和隐匿行为使非法占有目的争点由开放转为基本关闭。",
    "invariants": [
      "取走地点",
      "手机价值",
      "监控条件",
      "失主身份"
    ]
  },
  "quality_control": {
    "gold_hidden_from_model": true,
    "source_checked": true,
    "ids_checked": true,
    "leakage_checked": true,
    "second_review_status": "pending",
    "notes": "本数据集为课程项目的匿名化、要件驱动合成对照集；不将金标准或预写完整论证提供给模型。"
  }
}