{
  "case_id": "criminal_006a",
  "annotation_version": "2.0",
  "annotators": [
    {
      "annotator_id": "A01",
      "background": "法学与人工智能交叉背景学生（AI辅助初标后复核）",
      "role": "primary",
      "date": "2026-06-16"
    }
  ],
  "gold_fact_status": [
    {
      "fact_id": "F1",
      "gold_status": "established",
      "rationale": "该状态依据结构化材料和证据可见程度作出；确认的是该命题的证明状态，而非某一方的评价。"
    },
    {
      "fact_id": "F2",
      "gold_status": "established",
      "rationale": "该状态依据结构化材料和证据可见程度作出；确认的是该命题的证明状态，而非某一方的评价。"
    },
    {
      "fact_id": "F3",
      "gold_status": "established",
      "rationale": "该状态依据结构化材料和证据可见程度作出；确认的是该命题的证明状态，而非某一方的评价。"
    },
    {
      "fact_id": "F4",
      "gold_status": "established",
      "rationale": "该状态依据结构化材料和证据可见程度作出；确认的是该命题的证明状态，而非某一方的评价。"
    },
    {
      "fact_id": "F5",
      "gold_status": "established",
      "rationale": "该状态依据结构化材料和证据可见程度作出；确认的是该命题的证明状态，而非某一方的评价。"
    }
  ],
  "gold_issues": [
    {
      "issue_id": "I1",
      "issue_text": "关键供述的取得是否合法并具有可采性",
      "importance": "core",
      "issue_type": "evidence_admissibility",
      "related_fact_ids": [
        "F1",
        "F2",
        "F3",
        "F4"
      ],
      "related_evidence_ids": [
        "E1",
        "E2",
        "E3",
        "E4"
      ],
      "gold_status": "open",
      "rationale": "存在多项需要调查的非法取证风险信号。"
    },
    {
      "issue_id": "I2",
      "issue_text": "供述内容是否有独立证据印证",
      "importance": "secondary",
      "issue_type": "evidence_reliability",
      "related_fact_ids": [
        "F5"
      ],
      "related_evidence_ids": [
        "E1",
        "E5"
      ],
      "gold_status": "open",
      "rationale": "手机定位只证明在场可能，不能印证核心作案细节。"
    },
    {
      "issue_id": "I3",
      "issue_text": "若排除供述，剩余证据是否足以支持结论",
      "importance": "secondary",
      "issue_type": "procedure",
      "related_fact_ids": [
        "F5"
      ],
      "related_evidence_ids": [
        "E5"
      ],
      "gold_status": "open",
      "rationale": "剩余证据明显不足以完成核心事实证明。"
    }
  ],
  "gold_evidence_issue_map": [
    {
      "map_id": "M1",
      "evidence_id": "E1",
      "issue_id": "I1",
      "direction": "supports_prosecution",
      "strength": "partial",
      "reason": "供述内容具体。",
      "limitations": "取得程序和真实性存在重大争议。"
    },
    {
      "map_id": "M2",
      "evidence_id": "E2",
      "issue_id": "I1",
      "direction": "supports_defense",
      "strength": "strong",
      "reason": "完整录音录像缺失，无法还原讯问过程。",
      "limitations": "缺失本身不自动证明非法取证，但增加审查必要。"
    },
    {
      "map_id": "M3",
      "evidence_id": "E4",
      "issue_id": "I1",
      "direction": "supports_defense",
      "strength": "partial",
      "reason": "新鲜瘀伤与被告主张相呼应。",
      "limitations": "伤情原因仍需调查。"
    },
    {
      "map_id": "M4",
      "evidence_id": "E5",
      "issue_id": "I2",
      "direction": "supports_prosecution",
      "strength": "weak",
      "reason": "定位证明辛到过现场附近。",
      "limitations": "不能直接证明实施犯罪。"
    }
  ],
  "gold_evidence_gaps": [
    {
      "gap_id": "G1",
      "issue_id": "I1",
      "missing_information": "完整讯问录音录像、讯问人员说明和伤情形成原因",
      "importance": "critical",
      "resolvable_by": [
        "补充调取录像",
        "调查讯问人员",
        "医学说明"
      ],
      "impact_if_unresolved": "无法判断供述取得是否合法。"
    },
    {
      "gap_id": "G2",
      "issue_id": "I2",
      "missing_information": "能够独立印证核心作案细节的物证或证人",
      "importance": "critical",
      "resolvable_by": [
        "物证检验",
        "现场证人",
        "其他电子数据"
      ],
      "impact_if_unresolved": "供述真实性缺少外部支撑。"
    }
  ],
  "gold_safe_conclusion": {
    "conclusion_range": "leans_defense",
    "acceptable_positions": [
      "在合法性调查完成前不应将该供述作为稳定定案基础",
      "即使暂不排除，也必须显著降低其证明权重并审查独立印证"
    ],
    "unacceptable_assertions": [
      "供述内容具体就当然合法可信",
      "手机定位能够完全印证供述中的作案事实"
    ],
    "confidence": 0.93,
    "rationale": "采用合理结论范围而非唯一判决标签，重点评估系统是否识别核心争点、证据强弱和未解决缺口。"
  },
  "expected_deliberation": {
    "reasonable_disagreement_points": [
      "关键供述能否作为定案根据",
      "关键证据的证明强度",
      "是否存在足以改变结论的替代解释"
    ],
    "expected_role_differences": [
      "法律评议者应强调证明标准、证据链和程序要求",
      "社会评议者应关注误判风险与权利保护",
      "专家评议者应关注实务中的综合推断和制度后果",
      "公众评议者可能更受直观事实和结果影响"
    ],
    "position_change_not_required": false
  },
  "pair_expectation": {
    "paired_case_id": "criminal_006b",
    "manipulated_variable": "B案补入完整同步录音录像、权利告知和独立物证印证，供述可采性应明显增强。",
    "expected_direction_of_change": "B案补入完整同步录音录像、权利告知和独立物证印证，供述可采性应明显增强。",
    "invariants": [
      "供述内容",
      "手机定位",
      "案件基本事实",
      "被告身份"
    ]
  },
  "quality_control": {
    "gold_hidden_from_model": true,
    "source_checked": true,
    "ids_checked": true,
    "leakage_checked": true,
    "second_review_status": "pending",
    "notes": "本数据集为课程项目的匿名化、要件驱动合成对照集；不将金标准或预写完整论证提供给模型。"
  }
}