{
  "case_id": "criminal_003a",
  "annotation_version": "2.0",
  "annotators": [
    {
      "annotator_id": "A01",
      "background": "法学与人工智能交叉背景学生（AI辅助初标后复核）",
      "role": "primary",
      "date": "2026-06-16"
    }
  ],
  "gold_fact_status": [
    {
      "fact_id": "F1",
      "gold_status": "established",
      "rationale": "该状态依据结构化材料和证据可见程度作出；确认的是该命题的证明状态，而非某一方的评价。"
    },
    {
      "fact_id": "F2",
      "gold_status": "established",
      "rationale": "该状态依据结构化材料和证据可见程度作出；确认的是该命题的证明状态，而非某一方的评价。"
    },
    {
      "fact_id": "F3",
      "gold_status": "established",
      "rationale": "该状态依据结构化材料和证据可见程度作出；确认的是该命题的证明状态，而非某一方的评价。"
    },
    {
      "fact_id": "F4",
      "gold_status": "established",
      "rationale": "该状态依据结构化材料和证据可见程度作出；确认的是该命题的证明状态，而非某一方的评价。"
    },
    {
      "fact_id": "F5",
      "gold_status": "established",
      "rationale": "该状态依据结构化材料和证据可见程度作出；确认的是该命题的证明状态，而非某一方的评价。"
    }
  ],
  "gold_issues": [
    {
      "issue_id": "I1",
      "issue_text": "丙的行为与丁的轻伤结果之间是否存在刑法上的因果关系",
      "importance": "core",
      "issue_type": "causation",
      "related_fact_ids": [
        "F1",
        "F2",
        "F3",
        "F4",
        "F5"
      ],
      "related_evidence_ids": [
        "E1",
        "E2",
        "E3",
        "E4",
        "E5"
      ],
      "gold_status": "open",
      "rationale": "关键动作与致伤机制均未得到稳定证明。"
    },
    {
      "issue_id": "I2",
      "issue_text": "证人证言和监控片段能否证明具体伤害行为",
      "importance": "secondary",
      "issue_type": "evidence_reliability",
      "related_fact_ids": [
        "F3",
        "F4"
      ],
      "related_evidence_ids": [
        "E1",
        "E3"
      ],
      "gold_status": "open",
      "rationale": "视听材料不完整且证言互有矛盾。"
    }
  ],
  "gold_evidence_issue_map": [
    {
      "map_id": "M1",
      "evidence_id": "E1",
      "issue_id": "I1",
      "direction": "mixed",
      "strength": "partial",
      "reason": "监控证明冲突与伤后状态在时间上连续。",
      "limitations": "缺失关键致伤过程。"
    },
    {
      "map_id": "M2",
      "evidence_id": "E2",
      "issue_id": "I1",
      "direction": "supports_prosecution",
      "strength": "partial",
      "reason": "鉴定确认伤害结果。",
      "limitations": "未分析伤害由何种动作造成。"
    },
    {
      "map_id": "M3",
      "evidence_id": "E3",
      "issue_id": "I1",
      "direction": "mixed",
      "strength": "weak",
      "reason": "证人支持存在肢体冲突。",
      "limitations": "关键细节不一致。"
    },
    {
      "map_id": "M4",
      "evidence_id": "E4",
      "issue_id": "I1",
      "direction": "supports_defense",
      "strength": "partial",
      "reason": "旧伤提供替代原因。",
      "limitations": "旧伤是否足以造成本次结果仍需医学判断。"
    }
  ],
  "gold_evidence_gaps": [
    {
      "gap_id": "G1",
      "issue_id": "I1",
      "missing_information": "针对本案动作和旧伤的因果关系补充鉴定",
      "importance": "critical",
      "resolvable_by": [
        "补充鉴定",
        "医学专家说明"
      ],
      "impact_if_unresolved": "无法排除旧伤或自行摔倒等替代原因。"
    },
    {
      "gap_id": "G2",
      "issue_id": "I2",
      "missing_information": "关键十秒完整视频或其他目击材料",
      "importance": "critical",
      "resolvable_by": [
        "完整监控",
        "其他证人或现场数据"
      ],
      "impact_if_unresolved": "无法确认是否存在击打及倒地方式。"
    }
  ],
  "gold_safe_conclusion": {
    "conclusion_range": "insufficient_for_final_conclusion",
    "acceptable_positions": [
      "伤害结果成立，但行为与结果的因果链仍未闭合",
      "应补充医学因果意见和关键过程证据"
    ],
    "unacceptable_assertions": [
      "鉴定为轻伤二级就当然证明由丙造成"
    ],
    "confidence": 0.89,
    "rationale": "采用合理结论范围而非唯一判决标签，重点评估系统是否识别核心争点、证据强弱和未解决缺口。"
  },
  "expected_deliberation": {
    "reasonable_disagreement_points": [
      "伤害行为与轻伤结果是否具有因果关系",
      "关键证据的证明强度",
      "是否存在足以改变结论的替代解释"
    ],
    "expected_role_differences": [
      "法律评议者应强调证明标准、证据链和程序要求",
      "社会评议者应关注误判风险与权利保护",
      "专家评议者应关注实务中的综合推断和制度后果",
      "公众评议者可能更受直观事实和结果影响"
    ],
    "position_change_not_required": false
  },
  "pair_expectation": {
    "paired_case_id": "criminal_003b",
    "manipulated_variable": "B案补入完整监控和排除旧伤的医学因果意见，因果关系应显著向公诉方移动。",
    "expected_direction_of_change": "B案补入完整监控和排除旧伤的医学因果意见，因果关系应显著向公诉方移动。",
    "invariants": [
      "争执时间地点",
      "伤情等级",
      "参与人员",
      "被害人旧伤背景"
    ]
  },
  "quality_control": {
    "gold_hidden_from_model": true,
    "source_checked": true,
    "ids_checked": true,
    "leakage_checked": true,
    "second_review_status": "pending",
    "notes": "本数据集为课程项目的匿名化、要件驱动合成对照集；不将金标准或预写完整论证提供给模型。"
  }
}